batch,foundation_name,ein,contact_name,contact_title,linkedin_url,phone,phone_source,email,email_source,website,notes
58,Honda USA Foundation,953924667,,,,(310) 781-4090,Foundation Directory / Grantmakers.io,ahf@ahm.honda.com,Honda CSR website,https://csr.honda.com/,"Foundation directs all inquiries to general email (CommunitySupport@ahm.honda.com also available). No individual program officers listed publicly. Policy prohibits staff from advising on eligibility."
58,Honda USA Foundation,953924667,,,,(310) 781-0267,Candid Foundation Directory,CommunitySupport@ahm.honda.com,Honda FAQ page,https://csr.honda.com/,"Alternate phone and email for general inquiries. Small staff, no public directory available."
59,Houston Endowment Inc,746013920,Ann B. Stern,President and CEO,https://www.linkedin.com/in/ann-stern-0577aa26/,(713) 238-8100,Houston Endowment website,connect@houstonendowment.org,Houston Endowment website,https://houstonendowment.org/,"President and CEO since 2012. Leads $2.5B foundation with $100M+ annual grantmaking. Transitioning to Elisa Villanueva Beard on March 30, 2026."
59,Houston Endowment Inc,746013920,Tabitha Rice,Vice President of Programs,https://www.linkedin.com/in/tabitha-rice77005/,(713) 238-8100,Houston Endowment main number,trice@houstonendowment.org,Email format from website (first initial + last name),https://houstonendowment.org/,"Joined July 22, 2025. Oversees all grantmaking activities. 20+ years Houston experience, previously EVP at Texas Children's Hospital."
59,Houston Endowment Inc,746013920,Meghna Goswami,Program Director - Civic Engagement,https://www.linkedin.com/in/meghna-goswami-353aa129/,(713) 238-8100,Houston Endowment main number,mgoswami@houstonendowment.org,Email format from website (first initial + last name),https://houstonendowment.org/,"Program Director since June 2021. Leads civic engagement and voter participation strategy. Background in community development and immigrant rights."
59,Houston Endowment Inc,746013920,August Hamilton,Program Director - Education,https://www.linkedin.com/in/augustlmhamilton/,(713) 238-8100,Houston Endowment main number,ahamilton@houstonendowment.org,Email format from website (first initial + last name),https://houstonendowment.org/,"Joined June 2, 2025. Leads education strategy across Effective Educators, Postsecondary Success, and Statewide Advocacy. HBJ 2025 40 Under 40."
59,Houston Endowment Inc,746013920,Bao Long Chu,Program Director - Arts and Parks,,(713) 238-8100,Houston Endowment main number,bchu@houstonendowment.org,Email format from website (first initial + last name),https://houstonendowment.org/,"Program Director for Arts and Parks. Approximately 3+ years in role."
60,Intrepid Philanthropy Foundation,300527867,Karen Leshner,Founder and President,https://www.linkedin.com/today/author/karen-leshner-9ba6808,(415) 543-0733,ZoomInfo / Foundation listings,kleshner@intrepid-philanthropy.org,ZoomInfo (partially redacted as k***@intrepid-philanthropy.org),https://intrepid-philanthropy.org/,"Founded Intrepid in 2008. Private family foundation focused on California education. LIGHT Awards flagship program supports 300+ teachers. Accepts grants by invitation only. Background: electrical engineering (UVA), MBA (Vanderbilt), investment management."
60,Intrepid Philanthropy Foundation,300527867,,,,(415) 543-0733,Candid Foundation Directory,info@lightawards.org,LIGHT Awards program,https://intrepid-philanthropy.org/,"Alternate contact through LIGHT Awards program (foundation's flagship initiative). David (last name not publicly available) joined foundation in 2013, background in venture capital and early-stage tech investing."
